### ISSUE TITLE
nu mai merge

### ISSUE THREAD

**Issue by sincotan** [dexterke/plugin.video.digi.ro-online#16]
**Describe the bug**
afiseaza lista de programe dar nu ruleaza nici unul

**To Reproduce**

**Expected behavior**

**Screenshots**

**Platform & OS (please complete the following information):**
incercat cu KODI 18.9 pe linux mint 19.3, libreelec 18.9

**Additional context**
cred ca cei de la digi au schimbat ceva

**Comment by NickMihai** [comment]
Salutare!

Da, se pare ca tipii de la digi tocmai si-au reinnoit certificatul SSL si este activ din 28/03/2021, practic de cand nu mai vrea sa mearga jucaria asta draguta din python.

15:18:10 T:6216   ERROR: DEBUG:urllib3.connectionpool:Starting new HTTPS connection (1): www.digionline.ro:443
15:18:10 T:6216  NOTICE: .
15:18:10 T:6216   ERROR: DEBUG:urllib3.connectionpool:https://www.digionline.ro:443 "GET /auth/login HTTP/1.1" 200 None
15:18:10 T:6216  NOTICE: .
15:18:11 T:6216   ERROR: DEBUG:urllib3.connectionpool:https://www.digionline.ro:443 "POST /auth/login HTTP/1.1" 200 None
15:18:11 T:6216  NOTICE: .
15:18:11 T:6216   ERROR: DEBUG:urllib3.connectionpool:https://www.digionline.ro:443 "GET /stiri/realitatea-tv HTTP/1.1" 200 None
15:18:11 T:6216  NOTICE: .
15:18:11 T:6216 WARNING: Attempt to use invalid handle -1

La cat ma pricep, se pare ca nu se mai face autentificare prin TLS 1.1 (corectati-ma daca bat campii :)
Nu cred ca are de-a face cu un asa zis bug din api ci mai degrtaba cu faptul ca digi si-a facut vreun update de webserver si au renuntat la TLS 1.1 cum era pana acum, presupun.
Intrebarea este cum trecem peste faza asta?

**Comment by sincotan** [comment]
da, au trecut pe TLS 1.3 si cred ca trebuie urllib3 >1.26.0

**Comment by NickMihai** [comment]
Din pacate nu am reusit sa pun mai nou pe un kodi 16 decat aceasta versiune: script.module.urllib3-1.25.6. Ar mai fi 1.25.8 pe kodi matrix dar presupun ca deja il ai pe matrix... Am cautat si aici: https://pypi.org/project/urllib3/ dar nu am reusit sa gasesc o librarie compilata pt kodi. Se pare ca nu exista o librarie mai noua compilata inca pe kodi decat 1.25.8.

**Comment by dexterke** [comment]
Da văzut, am văzut.
Vă mulțumesc pentru interes :) încerc sa vad ce pot sa fac.

**Comment by NickMihai** [comment]
Multumesc mult pt dedicare.
Sper sa reusesti.

Toate cele bune!
Nicu

**Comment by dexterke** [comment]
Se pare ca DIGI au adăugat verificare CAPTCHA, nu știu ce pot să-i fac.

Am constatat ca pagina de logare conține un div:
```
...
id="form-login"\n                      method="post"\n                      action="/auth/login"\n                      data-recaptcha-action="login"\n  
...
<div data-this-count="0" data-token="6Le74JQaAAAAAOQErbRsqUFQ1nDVicj0mkPq2AIR"></div><script src="https://www.google.com/recaptcha/api.js?hl=ro" async defer></script>\n
...
```

iar la autentificare, mesajul POST, pe lângă user și parola, conține si răspunsul la provocarea CAPTCHA:

```
Internet Protocol Version 4, Src: 10.1.1.107, Dst: 81.196.14.168
Transmission Control Protocol, Src Port: 49225, Dst Port: 443, Seq: 1851, Ack: 64285, Len: 588
Transport Layer Security
HyperText Transfer Protocol 2
    Stream: DATA, Stream ID: 13, Length 557
    HTML Form URL Encoded: application/x-www-form-urlencoded
        Form item: "form-login-email" = "user@email"
        Form item: "form-login-password" = "****"
        Form item: "g-recaptcha-response" = "03AGdBq26IfLmv2Za9aNmeJUhpMAOw3TJM5mLLsIWpMEewLkNaG9p0f8bvXlx9fF0XqEUJjKvcrEcPBqVAlw0PspOJoPEM4UQsHFRFcn_3pTz6W9MtCHIXhsYhKbK3tseZoSrLrccNidLJpaQBZ6PcLJi5QnxTDo50beSHvidFJhoHxPGpsr-DvBSz6eWGGSrBdS5gOk92
```

**Comment by NickMihai** [comment]
Da, e tricky acum... Poate o putea sa rezolve duda asta: https://www.tvaddons.co/kodi-addons/show/script.module.resolveurl/

**Comment by alexfd** [comment]
Am incercat si eu in browser cu noscript blocand google.com si nu mai merge login: "Codul captcha nu este valid". Ce marlanie...

**Comment by 10ne1** [comment]
Din pacate codul captcha a omorat plugin-urile asemanatoare acestuia. E un cod conceput special sa blocheze accesul automat (non-uman), implementarea e de la Google, sansele sa fie ocolit sunt practic 0. Pacat, era fain sa ai Digi pe Kodi. Asta e.

**Comment by alexfd** [comment]
Nu trebuie ocolit, trebuie facuta o implementare de browser headless in care captcha-ul sa functioneze si sa poata fi extras. De zis e usor, de facut... nu stiu.

**Comment by 10ne1** [comment]
@alexfd Cred ca inteleg ce spui, adica sa nu se mai automatizeze logarea ci sa introduca utilizatorul captcha de fiecare data (poate si user+pass daca nu se poate extrage doar captcha si se afiseaza intreaga pagina). Cam aiurea si nu stiu cum s-ar integra captcha cu interfata Kodi, HDMI CEC...

In mod normal se genereaza un API access token de catre site pentru a fi folosit de aplicatii pentru a accesa API-ul, dar ofera Digi asa ceva?

**Comment by alexfd** [comment]
nu, nu la asta ma refeream, ci la emularea unui browser care permite rularea javascript. se generaza acel token captcha, este extras si trimis in POST impreuna cu user si parola. ar fi do-able deoarece inca nu au pus mizeriile acelea de captcha puzzle, deci inca mai e o sansa.

**Comment by 10ne1** [comment]
Scuza-ma dar mi se pare cam imposibil ce sugerezi, adica fix de-aia exista captcha, tocmai ca sa impiedice procesarea automata, "extragerea" de care vorbesti :) E nevoie de interventie umana. Google captcha e foarte inteligent, chiar daca prezinta doar o bifa odata sau de doua ori, e facut in asa fel incat sa-ti dea si puzzle la login repetat, verifica timpii de reactie pentru determinism specific algoritmilor samd. Greu il ocolesti.

Practic e un sistem avansat conceput sa impiedice sa faci exact ceea ce vrei tu sa faci...

"API access token" este solutia corecta pentru a evita interventia umana necesara pt captcha, 2FA si alte mecanisme de securitate, dar daca Digi nu permit asa ceva... nasol...

**Comment by alexfd** [comment]
Implementarea actuala pe form-ul login la digi nu este cum zici tu, cu puzzle sau bifa. Doar se genereaza un token in fundal in functie de sesiune,

**Comment by 10ne1** [comment]
Ah, atunci poate mai reusit sa o dregem :+1:

**Comment by 10ne1** [comment]
Update: Am facut o sesiune de debug pe python script-ul addonului si analizand request/respons-urile Digi am ajuns la concluzia ca foloseste "invistible recaptcha v3" de la Google care e foarte sofisticat, practic n-avem nici o sansa sa gasim o solutie generica automatizata, va fi doar "hit and miss" orice reusita, care oricum va fi foarte rara.

Aparent pare simplu ce spui tu @alexfd dar din pacate nu e chiar asa. Javascript-ul obfuscat de la Google nu poti sa-l rulezi de parca ar fi un md5sum pe un token unic, codul ala apeleaza algoritmi de AI special antrenati sa detecteze comportamentul uman, monitorizeaza inclusiv miscarile mouse-ului pe care le faci sau nu pe pagina.

Deci, repet, solutia corecta ar fi sa primim un "programatic API access token" de la Digi, ceea ce e nu cred ca sunt dispusi sa ofere.

Singura varianta fezaibila e sa expunem pagina de login direct in interfata de Kodi, sa-si introduca fiecare user cu manuta lui datele si sa demonstreze ca nu este robot. Din pacate nu vad alta alternativa.

**Comment by dexterke** [comment]
As fi curios cum se întâmplă autentificarea pe aplicația de Android, app-ul are inclusiv opțiune de `casting`, poate că folosesc `api token`.
Pe PC, știu cum să descifrez traficul SSL (așa am construit add-on-ul), dar pe Android ??? Am tot căutat pe forumuri dar nu am găsit nici o opțiune funcțională de captură/debug ssl.

**Comment by 10ne1** [comment]
@dexterke E o idee excelenta sa verificam cum functioneaza login-ul pe Android. :100:  Poate reusim sa extragem un token functional sau sa gasim o metoda alternativa de autentificare (m-am uitat rapid la permisiile cerute de aplicatie si am vazut ca poate folosi "setari de retea" pentru autentificare direct cu numarul de telefon).

Am un dispozitiv cu Android rootat pe care il folosesc pt. development, poate gasesc si niste timp sa decompilez / investighez aplicatia. Sa vedem.

**Comment by cralin** [comment]
De pe android se scot o gramada de date care permit sa fie identificat unic telefonul si cartela SIM care este in telefon si apoi se construieste un string lung ca naiba care este folosit pentru authentificare.

Sincer nu vad cum ai putea sa generezi automat in python asa ceva fara sa citesti datele din telefon si de pe cartela SIM.
Mai mult de atit, request-urile de pe aplicatia de telefon merg la un alt endpoint decit cele de pe pagina web.

Mizeria aia de reCAPTCHA e acolo ca sa previna scripturile/tool-urile (curl, requests, wget, etc.) care nu stiu sa proceseze automat codul javascript.

Daca te uiti bine in pagina de login ai sa vezi ca eventul de submit este interceptat din codul java script si apoi (dupa ce ajunge si codul reCAPTCHA de la goagal, se citesc din nou datele form-ului si se face un POST cu datele de la goagal incluse.

**Comment by cralin** [comment]
Token-ul de la Google este diferit de fiecare data cind faci POST, probabil ca are inclus si un timestamp ca sa-l faca unic, si este valabil 2 minute.
De asemenea, indiferent de cite ori il intrebi, goagal iti raspunde o singura data cu "success" pentru un token valid iar in rest iti zice "fail" ca sa nu poti sa retrimiti inca un request cu acelasi token in intervalul de 2 minute cit este valabil respectivul token.

**Comment by cralin** [comment]
> Pe PC, știu cum să descifrez traficul SSL (așa am construit add-on-ul), dar pe Android ??? Am tot căutat pe forumuri dar nu am găsit nici o opțiune funcțională de captură/debug ssl.

https://en.wikipedia.org/wiki/Man-in-the-middle_attack

**Comment by cralin** [comment]
> Nu trebuie ocolit, trebuie facuta o implementare de browser headless in care captcha-ul sa functioneze si sa poata fi extras.

Corect. 
Iar daca iti iese sa o faci, restul functioneaza fara nici o problema pina nu vine Digi cu ideea geniala sa schimbe iara ceva.

Sa nu uitam ca, virgula, codul addon-ului este public si orice workaround implementezi va putea fi vazut de de oricine (chiar si de angajatii din departamentul IT de la Digi). 
Daca workaround-ul implementat devine viral si este implementat in restul bot-ilor din internet apoi e doar o questie de timp pina cind se inchide si respectiva portitza.

**Comment by dexterke** [comment]
> > Pe PC, știu cum să descifrez traficul SSL (așa am construit add-on-ul), dar pe Android ??? Am tot căutat pe forumuri dar nu am găsit nici o opțiune funcțională de captură/debug ssl.
> 
> https://en.wikipedia.org/wiki/Man-in-the-middle_attack

La asta m-am referit, pe PC  știu cum să interceptez (adică man-in-the-middle) dar nu și pe android (complicat din cauza la SSL)

**Comment by dexterke** [comment]
> De pe android se scot o gramada de date care permit sa fie identificat unic telefonul si cartela SIM care este in telefon si apoi se construieste un string lung ca naiba care este folosit pentru authentificare.
> 
> Sincer nu vad cum ai putea sa generezi automat in python asa ceva fara sa citesti datele din telefon si de pe cartela SIM.
> Mai mult de atit, request-urile de pe aplicatia de telefon merg la un alt endpoint decit cele de pe pagina web.
> 
> Mizeria aia de reCAPTCHA e acolo ca sa previna scripturile/tool-urile (curl, requests, wget, etc.) care nu stiu sa proceseze automat codul javascript.
> 
> Daca te uiti bine in pagina de login ai sa vezi ca eventul de submit este interceptat din codul java script si apoi (dupa ce ajunge si codul reCAPTCHA de la goagal, se citesc din nou datele form-ului si se face un POST cu datele de la goagal incluse.

Nu cred că are nici o legatură cu SIM-ul deoarece app-ul funcționază si pe android PC/box (MiBox) etc

**Comment by 10ne1** [comment]
Logarea cu SIM / nr de telefon e doar una din metodele de autentificare, probabil pe PC/box se foleseste o alta metoda, probabil cu alt endpoint cu zicea mai sus @cralin :+1: 

Speranta mea e sa putem face rost de un token daca aplicatia Android contine asa ceva (poate fi mai complicat si daca exista, poate se foloseste criptografie si daca e la baza un chip TPM ne-am ars, dar nu ii cred eu pe Digi atat de sofisticati + ca nu toate dispozitivele au TPM) sau sa folosim direct endpoint-ul de Android de la Digi daca e posibil, samd.

Mereu va fi un joc "cat and mouse" intre solutia oficiala a departementele de IT din firme si solutiile neoficiale / open source. La fel cum e un joc "cat and mouse" intro Google captcha si cei care vor sa-l ocoleasca prin automatizare.

Va doresc success celor care vreti sa convengeti captcha ca scriptul e uman... De-ar fi atat de simplu incat sa fie suficient doar de rulat codul Google intr-un engine de JS din pluginul de python... Sa-mi spuneti daca reusiti si va trimit o lada sau doua de bere :)

Pana atunci incerc si eu sa scot ceva util din Android...

**Comment by cralin** [comment]
> De-ar fi atat de simplu incat sa fie suficient doar de rulat codul Google intr-un engine de JS din pluginul de python... Sa-mi spuneti daca reusiti si va trimit o lada sau doua de bere :)
> 

Poti deja sa-mi trimiti mie lazile alea cu bere.

Problema nu este daca se poate face sau nu din punct de vedere tehnic ci mai degraba daca Mallroy vrea sau nu sa arate publicului larg ca poate sa intercepteze, sa inspecteze si sa modifice communicatia dintre Alice si Bob si mai ales ca poate sa se impersoneze in fata lui Bob ca si cum ar fi Alice si in fata lui Alice ca si cum ar fi Bob.

https://en.wikipedia.org/wiki/File:Man_in_the_middle_attack.svg

**Comment by 10ne1** [comment]
Iti trimit cu cea mai mare placere dupa ce vad un pull request, citesc codul pentru captcha si il testez. Nu te supara dar povesti poate spune oricine. ;)

Stiu ce e un man in the middle si cum functioneaza SSL, dar nu aia e problema. Problema e cum treci de captcha (AI-ul Google) intr-un mod reproductibil, automat si fara interventie umana. Daca e asa usor, sa vedem codul si le voi spune celor de la Google sa se lase de meserie. :)

**Comment by 10ne1** [comment]
Am vesti bune, chiar mai bune decat ma asteptam initial.

Nu exista captcha pt API-urile folosite de Android si exista API direct de RequestToken doar pe baza de user + pass. API-urile sunt generice si "la liber", adica nu depind de mecanisme de securitate pe dispozitive si nici de OS. Deci este exact ce avem nevoie pentru un client alternativ cum e Kodi. :partying_face:

Deci pt mine directia e clara: trebuie convertit pluginul la API-urile programatice de servicii web pe care le apeleaza si Android si terminat cu povestea de procesat pagini web si captcha care sunt facute pt oameni.

**Comment by cralin** [comment]
> > > Pe PC, știu cum să descifrez traficul SSL (așa am construit add-on-ul), dar pe Android ??? Am tot căutat pe forumuri dar nu am găsit nici o opțiune funcțională de captură/debug ssl.
> > 
> > 
> > https://en.wikipedia.org/wiki/Man-in-the-middle_attack
> 
> La asta m-am referit, pe PC știu cum să interceptez (adică man-in-the-middle) dar nu și pe android (complicat din cauza la SSL)

@dexterke,
La tine in retea ai control complet la ce/unde misca pe acolo si pe deasupra poti sa-ti instalezi/conectezi componente/echipamente suplimentare cum vrea muschii tai.

Masina virtuala cu https://www.android-x86.org/ (in care instalezi apk-ul), man-in-the-middle pentru traficul care are sursa sau destinatie respectiva masina virtuala si vezi toate request-urile care se trimit de aplicatie si raspunsurile care le primeste.

Headere, cookies, POST, GET ... tot

**Comment by 10ne1** [comment]
Sincer doar va impuscati singuri in picior asa ca e prea low level ce vreti sa faceti. Se vede ca sunteti mai incepatori in ale computerelor si va spun asta fara suparare pentru ca vreau doar sa va ajut sa nu va loviti cu capul de pereti sau sa va faceti viata complicata singuri. :sweat_smile: 

Deci mult mai usor este sa cititi direct codul sursa al aplicatiei din apk si vedeti exact sunt API-urile si cum sunt folosite, ce valori se pun in fiecare camp, cum se valideaza, cum se stocheaza si folosesc raspunsurile pe Android samd, decat sa ghiciti orbeste doar pe baza comunicarii de retea.

E trivial pt orice utilizator capabil de Linux sa decompileze un APK (si e legal!), dar daca nu va descarcati, faceti upload la apk direct [pe site-ul asta](http://www.javadecompilers.com/apk) si dupa cateva minute primiti link de download catre codul sursa Java.

Sa-mi ziceti daca nu va descurcati cu Java sa va mai dau cateva pointere unde sa va uitati in codul sursa pentru ca e un limbaj destul de prost in sensul ca duce la "over-engineering", eventual in privat ca sa nu spamam aici. In principiu sunt 2 API-uri care ne intereseaza, unul pt DigiOnilne cu servere php (de ex auth se face [aici](https://digiapis.rcs-rds.ro/digionline/api/v13/user.php)) apelate prin [Retrofit](https://square.github.io/retrofit/) in clientul de Android (noi n-avem nevoie de retrofit pt Kodi) si unul pt DigiRomania prin JSON-RPC.

Succes!

**Comment by cralin** [comment]
Daca tot vrei sa ajut, ai decompilat aplicatia si stii ce face codul ala java, poti sa zici ce/cum se foloseste ca sa converteasca string-ul cu parola in cleartext in string-ul care se trimite la user.php cu request-ul ala GET care se face la autentificare.

De asemenea ai putea sa mai zici si ce alti parametrii sint trimsi la user.php cu request-ul GET si cum sint obtinuti acei parametrii.

**Comment by 10ne1** [comment]
String-ul cu parola clear text e trimis ca un hash md5, lucru care ar trebui sa fie evident privind hash-ul si observand caracterele si lungimea, dar si mai simplu e sa-ti dai seama citind direct codul:

`File: sources/p018ro/rcsrds/digionline/p020ui/auth/AuthDialog.java`
```
this.viewModel.loginWithDigionlineAccounts(this.binding.tilDigionlineEmail.getEditText().getText().toString().trim(), this.deviceUtils.generate_md5(this.binding.tilDigionlinePassword.getEditText().getText().toString()));
```

Toate detaliile de care aveti nevoie se gasesc in cateva fisiere din urmatoarele locatii care trebuie studiate atent pentru ca au logica atat pentru conturi DigiOnline cat si pentru DigiRomania:

`sources/p018ro/rcsrds/digionline/p020ui/auth`
`sources/p018ro/rcsrds/digionline/p020ui/auth/repository/`

API-urile pt serviciile PHP utilizate prin retrofit pt DigiOnline sunt documentate aici:

`sources/p018ro/rcsrds/digionline/support/api/client/RetrofitInterface.java`

Observati acolo cum se folosesc hash maps pentru parametrii si cum hash map-urile sunt populate in `AuthRepository.java`, unde str2 e md5 hash-ul calculat mai sus:

```
        hashMap.put("action", "registerUser");
        hashMap.put("user", str);
        hashMap.put("pass", str2);
```

Din pacate eu pot raspunde mai mult noaptea in weekend ca sunt foarte ocupat in timpul saptamanii, dar o sa incerc sa va mai ajut daca va blocati, just ask.

**Comment by cralin** [comment]
Restul parametrilor de unde vin si ce sint ?
Tot md5sum ?

**Comment by 10ne1** [comment]
Sunt exact aia care i-am scris mai sus, user in clear text si action=registerUser :)

Dupa ce se primeste cod 200 in `loginWithDigionlineCredentialsSuccess` se apeleaza `registerDevice` cu mai multi parametrii:

```
registerDevice(this.digiOnlineUsername, this.digiOnlinePasswordHash, digiOnlineLoginResponse.data.f554h, this.deviceUtils.getDeviceManufacturer(), this.deviceUtils.getDeviceModel(), this.deviceUtils.getDeviceOs(), this.deviceUtils.mo42624id());
```
unde `sources/p018ro/rcsrds/digionline/tools/auth/DeviceUtils.java` e folosit pentru a genera un "device id", lucru pe care il putem face si noi in python.

Incercati sa cititi si voi codul Java ca e doar o banala aplicatie web.

**Comment by sincotan** [comment]
Oare cei de la Digi vad ce incercam sa facem? Asta ar mai trebui, reCAPTCHA pe android.

**Comment by 10ne1** [comment]
@sincotan Nu cred ca ii intereseaza pe cei de la Digi pentru ca utilizatorii kodi cu pluginul asta sunt un procent nesemnificativ din totalul clientilor. De regula, din experienta mea, softurile alternative nu sunt suportate oficial dar nici nu sunt impiedicate in vre-un fel. Pur si simplu nu le pasa vendorilor, nu intereseaza, si de aceea apar "compatibility breakages".

Cel mai probabil recaptcha pe pagina web a fost introdus ca o masura de securitate obligatorie ceruta de Google (se impun foarte tare asupra clientilor cand vine vorba de securitate), cum multe site-uri introduc 2FA si din intamplare pluginul asta folosea interfata de pagina web, care evident e o problema de proiectare a pluginului.

Recaptcha pe Android nu cred ca se va introduce pentru ca aplicatiile din PlayStore sunt considerate "trusted" si verificate prin alte mecanisme cum e PlayProtect.

**Comment by cralin** [comment]
Dupa un GET la user.php cu "action=registerUser" vine un raspuns cu un json.

La ce este folosita valoarea livrata in cimpul "h" din json-ul primit in raspuns ?

**Comment by 10ne1** [comment]
@cralin E un per-user hash calculat de server, ca un cookie pe care trebuie sa-l tinem minte pentru a-l transmite inapoi cand apelam `registerDevice`. Pe Android, in `AuthRepository.java` valoarea primita de la server e stocata in `this.digiOnlineUserHash`.

Vezi modelul din urmatoarea locatie care are numele exact in structura de raspuns din sursa decompilata, e `f554h` in loc de h simplu (heh nici decompilatorul nu e perfect, mai are buguri).

`sources/p018ro/rcsrds/digionline/support/data/model/auth/DigiOnlineLoginResponse.java`

Tu n-ai sursele sa le citesti sau ma pui pe mine sa ti le citesc linie cu linie? :rofl:

**Comment by cralin** [comment]
LOL
Degeaba am sursele ca inca java nu stiu.

Poate ar fi bine sa ne auzim in privat ca sa putem sa discutam mai la concret.

**Comment by moromete** [comment]
Se poate face session hijack. Te loghezi pe un browser pe digionline si copiezi cooki-urile DOSESSV3PRI si deviceId pe care le setezi in addon si le incorporezi in orice request. Am facut asta si functioneaza perfect. Cel putin pana dau ei restart la servicii si sterg toate sesiunile (cateva zile chiar saptamani). In felul asta poti avea oricate device-uri logate pentru ca toate vor folosi acelasi deviceId. Am facut si o extensie care extrage cooki--urile astea automat si le transmite catre addon.

**Comment by cralin** [comment]
Tot inseamna ca trebuie sa te logezi de mina in browser si apoi sa faci de mina questii prin add-on ca sa foloseasca noile cookie-uri si un end-user fara know-how tehnic nu va reusi in veci sa o faca.
Mai mult, daca mai ruleaza kodi-ul ala pe/in Android-ul din televizor atci cel mai probabil ca o sa fie o provocare destul de mare sa "butoneze" prin codul addon-ului la care ajunge doar cu telecomanda.

**Comment by rapi3** [comment]
si daca anunti aici in public cit crezi ca dureaza pina va fi rezolvata vulnerabilitatea asta si nu va mai functiona deloc ?

**Comment by 10ne1** [comment]
Nu inteleg de unde vine paranoia voastra cu termeni "grei" precum vulnerabilitati, hijacking, man-in-the-middle de parca am face ceva interzis sau ilegal. Nu e nici o vulnerabilitate daca omul poate sa re-foloseasca un cookie valid pentru pe alte dispozitive de pe un cont real al sau personal, iar "session hijack" ar fi doar daca s-ar fura contul altcuiva fara acordul lui, samd. 

Bravo @moromete, e chiar o solutie foarte eleganta si inteligenta pt utilizatorii mai tehnici. Am aruncat o privire peste codul tau si arata chiar foarte bine.

De asemenea, repet, lipsa de suport Kodi din partea Digi si breakage ocazional nu e suficient sa presupunem rea vointa din partea lor. Ideea e ca sunt solutii tehnice bune pe care cei de la Digi n-au luat masuri sa le blocheze si le lasa "la liber" atat timp cat folosim conturi reale in platforma lor, nu facem piraterie si alte chestii urate, deci nu vad unde e problema.

Eu ma bucur ca deja avem doua drumuri deschise :+1:

**Comment by cralin** [comment]
@10ne1,

Pot ite rog sa-mi "traduci" ce face bucata de cod de mai jos care este parte din functia `getDeviceId()` in `DeviceUtils.java` ?

`String replaceAll = (((((((UUID.randomUUID().toString() + UUID.randomUUID().toString()) + UUID.randomUUID().toString()) + UUID.randomUUID().toString()) + UUID.randomUUID().toString()) + UUID.randomUUID().toString()) + UUID.randomUUID().toString()) + UUID.randomUUID().toString()).replaceAll("-", str2);
                int length = (128 - str4.length()) + -1;
                if (length <= 0 || replaceAll.length() < length) {
                    str2 = str4;
                } else {
                    str2 = str4 + "_" + replaceAll.substring(0, length);
                }
                return str2.replaceAll("\\W", "_").replaceAll("[^\\x00-\\x7F]", "_");`

**Comment by 10ne1** [comment]
@cralin Codul ala e din functia `generate_device_id()` din fisierul `DeviceUtils.java` si dupa cum iti poti da seama si din nume genereaza un id unic, de lungime fixa exact 128 de caractere cu formatul:

`ProducatorDispozitiv_ModelDispozitiv_UnixTimestamp_Padding`

Daca te uiti in functiile de mai sus (getDevice...) o sa vezi ca se accepta si valorile "unknown-manufacturer", "unknown-model" samd pentru producator si model, vor fi valori ca Samsung sau GalaxyS etc.

UnixTimestamp e un numar in format long integer care reprezinta cate secunde au trecut din 1 Ianuarie 1970 (vezi [pagina asta](https://en.wikipedia.org/wiki/Unix_time) pentru mai multa documentatie, eventual cauta si pe net cum sa obtii unix time in python).

Apoi restul de caractere pana la pozitia 128 sunt umplute cu caractere random, adica partea de `Padding` de la final generata prin concatenarea de [UUID-uri](https://en.wikipedia.org/wiki/Universally_unique_identifier) (foarte stupid din partea lor dar la ce sa te astepti de la niste amarati ca Digi...). 

Din padding ei sterg caracterul `-` (minus) pentru ca poate fi continut in celelalte campuri (eg manufacturer) apoi inlocuiesc whitespace si caracterele ASCII de la 0x00 pana la 0x7F cu `_`.

Eu spun sa-ti hardcodezi un ID si sa-l folosesti tot pe acelasi, n-are sens deocamdata sa tot generezi altul. Sa fii doar atent la lungime, sa fie un timestamp rezonabil din prezent (sa nu fie de saptamana trecuta sau din 6 Iunie 2030 :smile: ) si Padding-ul sa respecte regulile de mai sus.

**Comment by cralin** [comment]
Multumesc !
Cred ca am ce imi trebuie ca sa pot sa scriu in python ceva ce sa emuleze questia aia de registerDevice.

Din cite vad, functia `registerDevice` este apelata cu valoarea livrata in cimpul "h" din json-ul primit ca raspuns pentru GET la user.php cu "action=registerUser" (parametrul al treilea) dar in functia insasi acel parametru nu este folosit niciunde.

Este folosita altundeva valoare din cimpul h si mi-a scapat sau e doar o valoare returnata asa la misto ?

**Comment by cralin** [comment]
Am gasit si unde este folosita valoarea din cimpul h returnata de call cu `action=registerUser`.
In functia `loginWithUserPassword()`

**Comment by moromete** [comment]
> Tot inseamna ca trebuie sa te logezi de mina in browser si apoi sa faci de mina questii prin add-on ca sa foloseasca noile cookie-uri si un end-user fara know-how tehnic nu va reusi in veci sa o faca.
> Mai mult, daca mai ruleaza kodi-ul ala pe/in Android-ul din televizor atci cel mai probabil ca o sa fie o provocare destul de mare sa "butoneze" prin codul addon-ului la care ajunge doar cu telecomanda.

Intradevar trebuie sa te loghezi manual in browser inainte dar nu trebuie sa fie de pe acel Android. Orice calculator in aceeasi retea este la fel de bun.Si nu trebuie sa setezi manual acele cookie-uri. Se poate prim addon-uri de browser iar addon-ul de kodi  trebuie sa stie sa accepte setarile trimise catre el. Eu il folosesc de pe un Android box fara probleme si doar din cand in cand (zile)  trebuie sa apas un buton pe firefox-ul de pe laptop. Eu zic ca nu e prea complicat ....

**Comment by cralin** [comment]
Foarte probabil ca in weekend-ul acesta am sa am o versiune de [plugin.video.TVOnline.ro](https://github.com/cralin/plugin.video.TVOnline.ro) care sa foloseasca API-urile folosite de aplicatia de android.

Este doar questie de timp pina cind am ceva ce merge si poate fi testat de un cerc mai mare te utilizatori.

**Comment by sebastiancretu** [comment]
@cralin , exista vreo sansa sa poti updata si versiunea de plugin pentru kodi 18.9 ? Probabil vor mai fi si altii inafara de mine ce nu pot face upgrade la versiunea 19.

**Comment by cralin** [comment]
E doar questie de timp.
;)

**Comment by sebastiancretu** [comment]
> E doar questie de timp.
> ;)

Inteleg perfect. Cand este timp, nu e graba. Mersi mult!

**Comment by cralin** [comment]
Chiar daca repo-ul cu sursa pentru add-onul care merge pe Kodi 18 nu mai este disponibil pentru publicul larg, versiunile care folosesc API-urile aplicatiei de android vor fi disponibile pentru instalare prin Kodi repository.

https://github.com/cralin/repository.cralin.Kodi_18
https://github.com/cralin/repository.cralin.Kodi_19

**Comment by audiosistem** [comment]
https://github.com/moromete/firefox.cookie.digionline  poate ajuta

**Comment by moromete** [comment]
Am reusit sa fac api-ul sa mearga pentru canalele standard:
https://github.com/moromete/plugin.video.digionline/blob/master/resources/digi/digiapi.py
Pentru hbo si restul care sunt extra optiuni nu am user valid la digi ca sa pot scoate si restul de metode ....

**Comment by NickMihai** [comment]
@moromete - bravo domnule! Felicitari! Merge ca uns dar pe py3.0. Ai idee daca as avea vreo sansa sa mearga si pe distributii mai vechi? K16 de ex?

**Comment by 10ne1** [comment]
Bravo @moromete Vad ca ai implementat doar API-ul php pt conturi DigiOnline. Ai de gand sa implmentezi si API-ul pt conturi Digi Romania? Adresa e [asta](https://www.digionline.ro/api-ws/user-auth-v2/jsonRpc), pare un serviciu mai nou care foloseste API Tokens, logica e foarte asemanatoare cu login user+pass in aceiasi locatie in sursele Android.

@NickMihai Portarea de la python 3 la python 2 n-ar trebui sa fie prea grea, in orice caz mult mai usoara decat efortul pana acum.

**Comment by 10ne1** [comment]
Update: Din cate vad pe site-ul Digi, contul meu merge atat pe Digi Ro cat si pe DigiOnline, deci diferenta pare sa fie doar de API-uri pentru front-end.

Ar fi bine sa fie implementate ambele API-uri in caz ca unul din ele pica sau e anulat (cred ca API-ul php e mai vechi si are sanse mai mari sa fie scos), asa plugin-ul va fi mai rezistent in viitor pentru ca va incerca unul apoi fallback pe celalalt API.

**Comment by moromete** [comment]
O sa ma uit si peste logarea cu cont de digi. Pana acum nu am folosit-o deloc, dar nu ar trebui sa fie mare lucru. Ca metoda de avarie exista inca si posibilitatea de setare cookie-uri pe care eu am pastrat-o in caz ca se schimba ceva. Cat despre python 2 eu nu o sa-mi bat capul pentru ca nu prea vad sensul, dar daca vrea cineva codul e public.

**Comment by audiosistem** [comment]
Perfect!Multumesc,Moromete!Acum,intrebare:pot sa postez pe grupuri adresa de descarcare?

**Comment by moromete** [comment]
Poti sa postezi ce vrei tu ca oricum totul e public.  Am adaugat si epg pe api.

**Comment by audiosistem** [comment]
O rugaminte,daca este posibil.Poti face o grupare ALL,in addon?Asa l-as putea pune ca sursa in widget.Multumesc!

**Comment by alexfd** [comment]
> Cat despre python 2 eu nu o sa-mi bat capul pentru ca nu prea vad sensul, dar daca vrea cineva codul e public.
hmm, /me sad. Libreelec de ex. au ultimul release la 18.9, deci python 2. Si pe un Rpi B din 2012 probabil nici nu are rost sa incerc alta distributie.
@cralin sunt cu ochii pe commit history-ul tau ptr. v18 :D

**Comment by sylarRO** [comment]
> Am reusit sa fac api-ul sa mearga pentru canalele standard:
> https://github.com/moromete/plugin.video.digionline/blob/master/resources/digi/digiapi.py
> Pentru hbo si restul care sunt extra optiuni nu am user valid la digi ca sa pot scoate si restul de metode ....

Am eu extraoptiunele active, am cum sa ajut? Nu am cine stie ce cunostinte "tehnice" dar cu ceva instructiuni poate ma descurc. 

Inca ceva...Din tot ce am citit pe aici am ramas cu impresia ca addon'ul trebuie setat manual cu ceva cookie'uri sa functioneze ori la mine pe un chromecast cu google tv a mers fara probleme din prima. Nu am folosit nici una din extensiile pentru browser. Am avut doar noroc?...-:) Se poate intampla sa nu mai functioneze dupa ce cei de la digi restarteaza serverele? Ce trebuie facut atunci? 

P.S.: Multumesc celor care au creat si celor care tin in viata aceste addon'uri. Sunt exact ceea ce cautam.

**Comment by cralin** [comment]
@moromete,
Cred ca nu este necesar sa faci registerUser si registerDevice de cite ori vrei sa faci play la un stream.

App-ul face registerUser atunci cind iti bati parola prima data si face registerDevice daca nu exista deja deviceID-ul in fisierul salvat.
Daca iesi din aplicatie si intri din nou, iti face GET cu "action=authenticateUser"  (functia loginWithUserPassword).
Iti face din nou registerUser si registerDevice doar daca ii zici din aplicatie "Settings -> deconectare" si apoi ii bati din nou un username/parola pentru autentificare.

**Comment by binutzu** [comment]
Multe multumiri pt plugin si pt ca merge din nou!
L-am facut sa mearga pe libreelec (18.2) pe rpi3!

Deoarece modificarile sunt destul de simple, as putea pregati un PR. Asta daca nu a inceput deja cineva sa faca versiunea pt pyhon 2.x

**Comment by NickMihai** [comment]
@binutzu tare curios as fi sa testez varianta ta pe un K16.1 cu py2.7. Eu personal nu am reusit sa-l fac sa mearga pe py2.x si am incercat si conversie de cod din 3.x in 2.x dar fara succes. Imi lipseau unele prerechizite si nu am reusit sa le pun pe K16.1.
Lasa-mi te rog un link, ceva, la release-ul tau sa incerc pe K16.1. Poate o fi cu noroc. @moromete spunea ca el nu vede de ce ar face-o pt py2.x care e obsolete si il inteleg dar pe box-ul meu nu pot pune K19 din considerente de hardware si iata-ne iar la cheremul lui py2.x :)

**Comment by binutzu** [comment]
[plugin.video.digionline-0.3.3-k18.2.zip](https://github.com/dexterke/plugin.video.digi.ro-online/files/6411923/plugin.video.digionline-0.3.3-k18.2.zip)
@NickMihai: aici e zipul cu tot cu repo. Cred ca se poate instala direct, nu stiu cum se face din asta un release de addon ca la carte. Nu-i testat mai de loc. O data ce a pornit disney junior n-am mai apucat la telecomanda.

Am adaugat manual deviceId si DOS.... in settings. M-am incurcat putin cu fisierul .deviceId dar acela nu trebuie modificat - va fi generat automat si e ceva cu Android pt digiapi.
Sunt curios daca varianta asta mai functioneaza la cineva.

**Comment by NickMihai** [comment]
@binutzu, multumesc frumos de ajutor dar nu a functionat pe K16.1. Cel mai probabil vreun modul de SSL obsolete, nu am stat sa fac debug mai departe... Atasez aici un log, daca intereseaza pe cineva dar nu as crede :)

20:56:11 T:4056  NOTICE: [plugin.video.digionline-0.3.3]: before get params
20:56:11 T:4056   ERROR: C:\Users\NICK\AppData\Roaming\Kodi\addons\script.module.urllib3\lib\urllib3\util\ssl_.py:380: SNIMissingWarning: An HTTPS request has been made, but the SNI (Server Name Indication) extension to TLS is not available on this platform. This may cause the server to present an incorrect TLS certificate, which can cause validation failures. You can upgrade to a newer version of Python to solve this. For more information, see https://urllib3.readthedocs.io/en/latest/advanced-usage.html#ssl-warnings
                                              SNIMissingWarning,
20:56:11 T:4056   ERROR: C:\Users\NICK\AppData\Roaming\Kodi\addons\script.module.urllib3\lib\urllib3\util\ssl_.py:139: InsecurePlatformWarning: A true SSLContext object is not available. This prevents urllib3 from configuring SSL appropriately and may cause certain SSL connections to fail. You can upgrade to a newer version of Python to solve this. For more information, see https://urllib3.readthedocs.io/en/latest/advanced-usage.html#ssl-warnings
                                              InsecurePlatformWarning,
20:56:12 T:4056   ERROR: EXCEPTION Thrown (PythonToCppException) : -->Python callback/script returned the following error<--
                                             - NOTE: IGNORING THIS CAN LEAD TO MEMORY LEAKS!
                                            Error Type: <class 'requests.exceptions.SSLError'>
                                            Error Contents: HTTPSConnectionPool(host='digiapis.rcs-rds.ro', port=443): Max retries exceeded with url: /digionline/api/v13/categorieschannels.php (Caused by SSLError(CertificateError("hostname 'digiapis.rcs-rds.ro' doesn't match either of '*.iw.ro', 'iw.ro'",),))
                                            Traceback (most recent call last):
                                              File "C:\Users\NICK\AppData\Roaming\Kodi\addons\plugin.video.digionline\default.py", line 365, in <module>
                                                listCat()
                                              File "C:\Users\NICK\AppData\Roaming\Kodi\addons\plugin.video.digionline\default.py", line 53, in listCat
                                                cats = digi.getCategories()
                                              File "C:\Users\NICK\AppData\Roaming\Kodi\addons\plugin.video.digionline\resources\digi\digiapi.py", line 134, in getCategories
                                                response = requests.get(url)
                                              File "C:\Users\NICK\AppData\Roaming\Kodi\addons\script.module.requests\lib\requests\api.py", line 75, in get
                                                return request('get', url, params=params, **kwargs)
                                              File "C:\Users\NICK\AppData\Roaming\Kodi\addons\script.module.requests\lib\requests\api.py", line 60, in request
                                                return session.request(method=method, url=url, **kwargs)
                                              File "C:\Users\NICK\AppData\Roaming\Kodi\addons\script.module.requests\lib\requests\sessions.py", line 533, in request
                                                resp = self.send(prep, **send_kwargs)
                                              File "C:\Users\NICK\AppData\Roaming\Kodi\addons\script.module.requests\lib\requests\sessions.py", line 646, in send
                                                r = adapter.send(request, **kwargs)
                                              File "C:\Users\NICK\AppData\Roaming\Kodi\addons\script.module.requests\lib\requests\adapters.py", line 514, in send
                                                raise SSLError(e, request=request)
                                            SSLError: HTTPSConnectionPool(host='digiapis.rcs-rds.ro', port=443): Max retries exceeded with url: /digionline/api/v13/categorieschannels.php (Caused by SSLError(CertificateError("hostname 'digiapis.rcs-rds.ro' doesn't match either of '*.iw.ro', 'iw.ro'",),))
                                            -->End of Python script error report<--
20:56:12 T:9368   ERROR: XFILE::CDirectory::GetDirectory - Error getting plugin://plugin.video.digionline/
20:56:12 T:9368   ERROR: CGUIMediaWindow::GetDirectory(plugin://plugin.video.digionline/) failed

In primul rand tin sa-i multumesc lui @moromete pt munca grozava depusa sa faca sa mearga din nou acest plugin exact cum merge si pe android iar asta ma face sa cred ca va functiona mult si bine de-acum. Sau cel putin asa ar trebui.

**Comment by cralin** [comment]
plugin.video.TVOnline.ro  v19.2.0 merge pe Kodi 19 si stie sa faca play si la canalele cu DRM (Cinemax Cinemaxx2, HBO, HBO2, HBO3).

L-am testat cu LibreELEC in masina virtuala si pe RPI4.
Poate fi instalat din repo-ul de aici: https://github.com/cralin/repository.cralin.Kodi_19

@dexterke,
Multumesc ca ai lasat threadul acesta sa mearga chiar daca dicutia a deviat de la ce s-a raportat initial in acest Issue.

**Comment by cralin** [comment]
> plugin.video.TVOnline.ro v19.2.0 merge pe Kodi 19 si stie sa faca play si la canalele cu DRM (Cinemax Cinemax2, HBO, HBO2, HBO3).
> 
> L-am testat cu LibreELEC in masina virtuala si pe RPI4.
> Poate fi instalat din repo-ul de aici: https://github.com/cralin/repository.cralin.Kodi_19
> 
> @dexterke,
> Multumesc ca ai lasat threadul acesta sa mearga chiar daca dicutia a deviat de la ce s-a raportat initial in acest Issue.

Si de asemena multumiri lui @10ne1 pentru "traducerile" din codul Jav(r)a.

**Comment by binutzu** [comment]
> 20:56:12 T:4056 ERROR: EXCEPTION Thrown (PythonToCppException) : -->Python callback/script returned the following error<--
> - NOTE: IGNORING THIS CAN LEAD TO MEMORY LEAKS!
> Error Type: <class 'requests.exceptions.SSLError'>
> Error Contents: HTTPSConnectionPool(host='digiapis.rcs-rds.ro', port=443): Max retries exceeded with url: /digionline/api/v13/categorieschannels.php (Caused by SSLError(CertificateError("hostname 'digiapis.rcs-rds.ro' doesn't match either of '_.iw.ro', 'iw.ro'",),)) 

SNI pare a fi un warning, iar eroarea e legata de verificarea hostului. Poti incerca urmatorul lucru pt a nu mai verifica hostname, doar de test, si evident e doar pt acest plugin.

In default.py adauga la sectiunea de import
`import ssl`
iar mai apoi
`ssl.match_hostname = lambda cert, hostname: True`

**Comment by cralin** [comment]
plugin.video.DigiOnline.ro v18.2.0 merge pe Kodi 18 si stie sa faca play si la canalele cu DRM (Cinemax Cinemax2, HBO, HBO2, HBO3).

L-am testat la repezeala cu LibreELEC 9.2.6 in masina virtuala.
Poate fi instalat din repo-ul de aici: https://github.com/cralin/repository.cralin.Kodi_18

Daca aveti instalari cu versiuni anterioare, recomand cu caldura uninstall la versiunea anterioara + delete la addon settings si apoi instalare la versiunea 18.2.0.

Setarile pentru contul de DigiOnline.ro au fost extinse iar informatiile care sint necesare pentru cimpurile suplimentare le gasiti in Androizii vostri la Settings -> About Device.

**Comment by audiosistem** [comment]
moromete,10ne1,cralin,binutzu(in ordine sau aleatoriu)si celor ce ati contribuit,eu unul,va multumesc!

**Comment by sylarRO** [comment]
@cralin sa traiesti!
Merge perfect pe un Chromecast cu Google TV - Kodi 19.
Integrarea cu PVR'ul functioneaza fara probleme si creeaza o experienta geniala!
Multumesc!

**Comment by cralin** [comment]
@10ne1 
> Daca iesi din aplicatie si intri din nou, iti face GET cu "action=authenticateUser" (functia loginWithUserPassword).

Imi bat capul de vreo citeva zile cu action=authenticateUser.
Vad request-ul (cu toti parametrii) trimis de aplicatie inspre user.php dar inca nu reusesc sa replic checksum-ul asta:
md5(username + password + deviceId + this.sharedPreferences.getUsernameHash()));

Pina acum am presupus ca in acest context "username" este user-ul meu de autentificare (cleartext), "password" este md5-ul parolei mele.

Poti te rog sa mai arunci o privire prin codula ala Jav(r)a si sa vezi ce ar trebui sa fie returnat de `this.sharedPreferences.getUsernameHash()` ?

Un md5 al numelui de utilizator care il introduc eu pentru contul meu sau este valoarea care o primesc in cimpul "h" cind fac primul registerUser ?

Multumesc.

**Comment by audiosistem** [comment]
Salut!In kodi,merge foarte bine cu cale in LiveTV,channel si epg.Inca o data,va multumesc!Sa aveti o zi buna!
![EPG](https://user-images.githubusercontent.com/6246768/117103271-b17c5000-ad82-11eb-9071-1f3c04e1fe31.jpg)

**Comment by 10ne1** [comment]
@cralin Sunt în junglă și acum am prins un moment de respiro cu petec de semnal. Mai durează cel puțin o săptămână până revin în civilizație in fața unui PC. Scuze de delay îți voi

**Comment by audiosistem** [comment]
> plugin.video.digionline-0.3.3-k18.2.zip

Merge in Kato(17.3)...fara speciale,e ok.Singurul impediment(dar nu-i bai),nu genereaza ca la addon-urile lui Cralin,m3u sau xml sa -l poti adauga in PVR IPTV,dar exista si .epg util.Multumesc,Moromete si Sile!

**Comment by cralin** [comment]
> @cralin Sunt în junglă și acum am prins un moment de respiro cu petec de semnal. Mai durează cel puțin o săptămână până revin în civilizație in fața unui PC. Scuze de delay îți voi

Mai esti in jungla inca ?
sa vorbesc cu ceva prieteni sa trimita un elicopter Apache dupa tine ?

**Comment by 10ne1** [comment]
@cralin Am revenit dar sunt foarte ocupat, raspund greu, scuze din nou. Tu oferi prea mult credit aplicatiei crezand ca parola e stocata ca hash md5, nici macar atat, e clear text, parca suntem cu totii in jungla lucrand pe codul asta scris de maimutele digi.

Deci campurile `username`, `password, si `deviceId` sunt in clear text, nu trebuie sa faci md5 pe password, iar `this.sharedPreferences.getUsernameHash()` e valoarea ce o primesti in `h` ca raspuns de la server. Le concatenezi apoi faci md5sum pe tot.

Ai grija sa pui toate valorile ca in hashMap in request-ul catre server, c-ul de la final contine md5-ul de mai sus. O fi doar un checksum stupid in caz de coruptie care oricum e redundant pt ca din cate imi amintesc se foloseste TCP pt auth (sau nu?).

Anyway, sper sa reusesti.

**Comment by alexfd** [comment]
ERROR: DEBUG:urllib3.connectionpool:Starting new HTTPS connection (1): digiapis.rcs-rds.ro:443
  ERROR: DEBUG:urllib3.connectionpool:https://digiapis.rcs-rds.ro:443 "GET /digionline/api/... HTTP/1.1" 200 None
  NOTICE: Creating InputStream
  ERROR: CCurlFile::FillBuffer - Failed: SSL peer certificate or SSH remote key was not OK(60)
  ERROR: CCurlFile::Open failed with code 0 for https://edge210.rcs-rds.ro/....
  NOTICE: CVideoPlayer::OnExit()
  NOTICE: CVideoPlayer::CloseFile()
  NOTICE: VideoPlayer: waiting for threads to exit
  NOTICE: VideoPlayer: finished waiting

folosesc un proxy mai incarligat. aveti idei ce trebuie sa modific ca sa ignore validitatea certificatului ssl?

**Comment by cralin** [comment]
_verifypeer=false_    in header

https://github.com/cralin/plugin.video.TVOnline.ro/blob/91d9118c7e60bd039fbabd11746152d11cf63baf/resources/lib/digionline/functions.py#L794

**Comment by alexfd** [comment]
A testat cineva plugin.video.DigiOnline.ro-18.2.1 pe Kodi 18? As vrea sa stiu daca merge play la canale DRM precum HBO.
La mine da eroare dupa ce citeste fisierul .mpd:
`CFileCache::Process - Source read didn't return any data! Hit eof(?)`

**Comment by audiosistem** [comment]
Salut,in Matrix functioneaza perfect,pe Leia doar cele fara drm.Stiu ca este istorie(cumva)dar,daca cineva cu pricepere(dintre cei care au contribuit sau au ajutat),l-ar face functional si-n Leia,ne-am bucura de munca sa(lor).Cu multumiri!

**Comment by sebastiancretu** [comment]
Pe raspberry pi3B cu OSMC si kodi pare ca nu mai merge din nou. Am incercat v18.2.0 si 18.2.1. Pe restul de platforme functioneaza ? Aici este si logul daca cumva ajuta ([https://paste.osmc.tv/oyiwibutib](https://paste.osmc.tv/oyiwibutib))

**Comment by alexfd** [comment]
la mine merge (nu si drm), 18.2.1 pe kodi 18 pe rpi3b, il folosesc zilnic.

**Comment by audiosistem** [comment]
> A testat cineva plugin.video.DigiOnline.ro-18.2.1 pe Kodi 18? As vrea sa stiu daca merge play la canale DRM precum HBO.
> La mine da eroare dupa ce citeste fisierul .mpd:
> `CFileCache::Process - Source read didn't return any data! Hit eof(?)`

A fost o perioada,cand a mers si-n Leia,cu DRM.L-am frecat pe toate partile,DRM instalat,nu mai vrea.Cralin a declarat ca l-a facut la rugamintea unor prieteni.Am trecut pe Matrix,totul perfect si fluent,dar am o problema cu TMDB.Asa ca ai de ales.

**Comment by 98c71be8** [comment]
Salut,
Ii merge cuiva add-on pe Kodi 18.9? 
Login pare sa mearga dat postul nu este afisat

In Debug log apar 2 linii cu error la finalul fisierului de log:

[GCC 8.3.0]
Python info: sys.version_info(major=2, minor=7, micro=16, releaselevel='final', serial=0)
osdInfo_Enabled: true
userAgent: Mozilla/5.0 (Macintosh; Intel Mac OS X 10_13_6) AppleWebKit/537.36 (KHTML, like Gecko) Chrome/71.0.3578.98 Safari/537.36
Login_User: aefqvlcn4hut@opayq.com
cfg_dir: /home/osmc/.kodi/userdata/addon_data/plugin.video.digi.ro-online/
parseInput received URL: https://www.digionline.ro/stiri/digi24
processHTML received URL: https://www.digionline.ro/stiri/digi24 - Section: stiri

processHTML WARNING: File /home/osmc/.kodi/userdata/addon_data/plugin.video.digi.ro-online/digionline.ro.cookie does not exist
processHTML session cookies: {'prv_level': '15'}
processHTML method: GET
processHTML url https://www.digionline.ro/auth/login
processHTML send headers: {'Host': 'www.digionline.ro', 'Accept-Language': 'en-ie', 'Accept-Encoding': 'identity', 'Cache-Control': 'max-age=0', 'User-Agent': 'Mozilla/5.0 (Macintosh; Intel Mac OS X 10_13_6) AppleWebKit/537.36 (KHTML, like Gecko) Chrome/71.0.3578.98 Safari/537.36', 'Connection': 'keep-alive', 'Accept': 'text/html,application/xhtml+xml,application/xml;q=0.9,image/webp,image/apng,*/*;q=0.8', 'Upgrade-Insecure-Requests': '1'}
processHTML status_code: 200
processHTML received headers: {'X-A-ccd': '{"trc":"4.0","zca":"0.137","agM":"0.135","tym":"0.001"}', 'Transfer-Encoding': 'chunked', 'X-Frame-Options': 'deny', 'Expires': 'Thu, 19 Nov 1981 08:52:00 GMT', 'Pragma': 'no-cache', 'Date': 'Sun, 05 Sep 2021 18:46:42 GMT', 'X-A-dcw': '{"trc":"0.0","zca":"0.000","agM":"0.000","tym":"0.000"}', 'X-Cache': 'MISS', 'Set-Cookie': 'DOSESSV3PRI=4C0AA31C297E4D9E8267E09CAAEECC651308C846FA77436A; path=/; domain=digionline.ro; HttpOnly', 'Accept-Ranges': 'bytes', 'Cache-Control': 'no-store, no-cache, must-revalidate', 'X-A-dgt': '{"dft":"0.15"}', 'Connection': 'keep-alive', 'Server': 'RDS-WebServer v2', 'X-A-dam': '{"dbm":"2.000","dcp":"2.000"}', 'X-D': 'Sun, 05 Sep 2021 18:46:43 GMT', 'X-G': 'none', 'Vary': 'User-Agent, Accept-Encoding', 'X-A': '0', 'X-B': 'v7wwwv93', 'X-A-wwc': '{"trc":"6.0","zca":"0.004","agM":"0.001","tym":"0.000"}', 'Content-Type': 'text/html; charset=UTF-8', 'X-S': 'vdigionline'}
processHTML received cookies: {'DOSESSV3PRI': '4C0AA31C297E4D9E8267E09CAAEECC651308C846FA77436A'}
processHTML cookie: {'comment': None, 'domain': '.digionline.ro', 'name': 'DOSESSV3PRI', 'domain_initial_dot': False, 'expires': None, 'value': '4C0AA31C297E4D9E8267E09CAAEECC651308C846FA77436A', 'domain_specified': True, '_rest': {'HttpOnly': None}, 'version': 0, 'port_specified': False, 'rfc2109': False, 'discard': True, 'path_specified': True, 'path': '/', 'port': None, 'comment_url': None, 'secure': False}


processHTML session cookies: {'DOSESSV3PRI': '4C0AA31C297E4D9E8267E09CAAEECC651308C846FA77436A', 'prv_level': '15'}
processHTML method: POST
processHTML url https://www.digionline.ro/auth/login
processHTML send headers: {'Accept-Language': 'en-ie', 'Accept-Encoding': 'identity', 'Connection': 'keep-alive', 'Upgrade-Insecure-Requests': '1', 'Content-type': 'application/x-www-form-urlencoded', 'Origin': 'https://www.digionline.ro', 'Accept': 'text/html,application/xhtml+xml,application/xml;q=0.9,image/webp,image/apng,*/*;q=0.8', 'User-Agent': 'Mozilla/5.0 (Macintosh; Intel Mac OS X 10_13_6) AppleWebKit/537.36 (KHTML, like Gecko) Chrome/71.0.3578.98 Safari/537.36', 'Host': 'www.digionline.ro', 'Referer': 'https://www.digionline.ro/auth/login', 'Cache-Control': 'max-age=0'}

processHTML post_data: {'form-login-email': '*****************', 'form-login-password': '**************************'}
processHTML status_code: 200
processHTML received headers: {'X-A-ccd': '{"trc":"3.0","zca":"0.026","agM":"0.024","tym":"0.001"}', 'Transfer-Encoding': 'chunked', 'X-Frame-Options': 'deny', 'Expires': 'Thu, 19 Nov 1981 08:52:00 GMT', 'Pragma': 'no-cache', 'Date': 'Sun, 05 Sep 2021 18:46:42 GMT', 'X-A-dcw': '{"trc":"0.0","zca":"0.000","agM":"0.000","tym":"0.000"}', 'X-Cache': 'MISS', 'Accept-Ranges': 'bytes', 'X-A-wwc': '{"trc":"6.0","zca":"0.004","agM":"0.001","tym":"0.000"}', 'X-A-dgt': '{"dft":"0.22"}', 'Connection': 'keep-alive', 'Server': 'RDS-WebServer v2', 'X-A-dam': '{"dbm":"2.000","dcp":"2.000"}', 'X-D': 'Sun, 05 Sep 2021 18:46:43 GMT', 'X-G': 'none', 'Vary': 'User-Agent, Accept-Encoding', 'X-A': '0', 'X-B': 'v7wwwv93', 'Cache-Control': 'private, no-cache', 'Content-Type': 'text/html; charset=UTF-8', 'X-S': 'vdigionline'}
processHTML received cookies: {}

processHTML session cookie: DOSESSV3PRI, value: 4C0AA31C297E4D9E8267E09CAAEECC651308C846FA77436A
processHTML session cookie: prv_level, value: 15
processHTML session cookies: {'DOSESSV3PRI': '4C0AA31C297E4D9E8267E09CAAEECC651308C846FA77436A', 'prv_level': '15'}
processHTML method: GET
processHTML url https://www.digionline.ro/stiri/digi24
processHTML send headers: {'Host': 'www.digionline.ro', 'Referer': 'https://www.digionline.ro/stiri', 'Accept-Encoding': 'identity', 'Cache-Control': 'max-age=0', 'Accept-Language': 'en-ie', 'User-Agent': 'Mozilla/5.0 (Macintosh; Intel Mac OS X 10_13_6) AppleWebKit/537.36 (KHTML, like Gecko) Chrome/71.0.3578.98 Safari/537.36', 'Connection': 'keep-alive', 'Accept': 'text/html,application/xhtml+xml,application/xml;q=0.9,image/webp,image/apng,*/*;q=0.8', 'Upgrade-Insecure-Requests': '1'}
processHTML status_code: 200
processHTML received headers: {'X-A-ccd': '{"trc":"3.0","zca":"0.030","agM":"0.028","tym":"0.001"}', 'Transfer-Encoding': 'chunked', 'X-Frame-Options': 'deny', 'Expires': 'Thu, 19 Nov 1981 08:52:00 GMT', 'Pragma': 'no-cache', 'Date': 'Sun, 05 Sep 2021 18:46:43 GMT', 'X-A-dcw': '{"trc":"0.0","zca":"0.000","agM":"0.000","tym":"0.000"}', 'X-Cache': 'MISS', 'Set-Cookie': 'recentTvChannelIDs=1343; expires=Mon, 05-Sep-2022 18:46:43 GMT; Max-Age=31536000; path=/', 'Accept-Ranges': 'bytes', 'Cache-Control': 'no-store, no-cache, must-revalidate', 'X-A-dgt': '{"dft":"0.45"}', 'Connection': 'keep-alive', 'Server': 'RDS-WebServer v2', 'X-A-dam': '{"dbm":"8.000","dcp":"8.000"}', 'X-D': 'Sun, 05 Sep 2021 18:46:44 GMT', 'X-G': 'none', 'Vary': 'User-Agent, Accept-Encoding', 'X-A': '0', 'X-B': 'v1wwwv27', 'X-A-wwc': '{"trc":"10.0","zca":"0.012","agM":"0.003","tym":"0.001"}', 'Content-Type': 'text/html; charset=UTF-8', 'X-S': 'vdigionline'}
processHTML received cookies: {'recentTvChannelIDs': '1343'}
processHTML cookie: {'comment': None, 'domain': 'www.digionline.ro', 'name': 'recentTvChannelIDs', 'domain_initial_dot': False, 'expires': 1662403604, 'value': '1343', 'domain_specified': False, '_rest': {}, 'version': 0, 'port_specified': False, 'rfc2109': False, 'discard': False, 'path_specified': True, 'path': '/', 'port': None, 'comment_url': None, 'secure': False}


processHTML ERROR: could not detect nowPlaying_Info: list index out of range
processHTML ERROR: could not detect nowPlaying_Plot: list index out of range

**Comment by cralin** [comment]
> Pe raspberry pi3B cu OSMC si kodi pare ca nu mai merge din nou. Am incercat v18.2.0 si 18.2.1. Pe restul de platforme functioneaza ? Aici este si logul daca cumva ajuta (https://paste.osmc.tv/oyiwibutib)

Pe RPI4 cu LibreELEC 10 (Kodi 19.1) si ultima versiune din seria 19.x.y merg toate canalele (chiar si alea cu DRM).

**Comment by sincotan** [comment]
pe Kodi 18.9(sub linux) merge. la fel si pe Libreelec 9.2(Kodi 18.9)

**Comment by audiosistem** [comment]
Functioneaza!Verifica,pe cate device-uri esti conectat(poate ai depasit).Reinstal.Toate campurile trebuiesc completate,in setting,la addon.

**Comment by audiosistem** [comment]
Salut,
in cazul ca va puteti impartasi cunostintele(despre kodi)ajutand,si v-ar face placere 
https://t.me/kodiromania!
O zi buna!

**Comment by sincotan** [comment]
Chiar in acest moment sectiunea Filme da eroare in digiapi.py:

```
 ERROR: EXCEPTION Thrown (PythonToCppException) : -->Python callback/script returned the following error<--
                                             - NOTE: IGNORING THIS CAN LEAD TO MEMORY LEAKS!
                                            Error Type: <type 'exceptions.TypeError'>
                                            Error Contents: int() argument must be a string or a number, not 'NoneType'
                                            Traceback (most recent call last):
                                              File "/home/xxx/.kodi/addons/plugin.video.digionline/default.py", line 367, in <module>
                                                listCh(url = url, idCat=idCat)
                                              File "/home/xxx/.kodi/addons/plugin.video.digionline/default.py", line 75, in listCh
                                                activeProgram = digi.getChannelActiveEpg(ch['id'])
                                              File "/home/xxx/.kodi/addons/plugin.video.digionline/resources/digi/digiapi.py", line 204, in getChannelActiveEpg
                                                if(now >= int(programItem['start_ts']) and now <= int(programItem['end_ts'])):
                                            TypeError: int() argument must be a string or a number, not 'NoneType'
                                            -->End of Python script error report<--
```
Pare ca sunt situatii in care EPG-ul returneaza "None" (NoneType) pentru programItem['start_ts'] sau programItem['end_ts'].
O rezolvare ar fi verificarea lor inainte de int().

```
  def getChannelActiveEpg(self, idChannel):
    now = int(time.time())
    chEpg = self.getChannelEpg(idChannel)
    #print(chEpg)
    if(chEpg):
      for programItem in chEpg:
        if((programItem['start_ts'])!= None and (programItem['end_ts'])!= None):
          if(now >= int(programItem['start_ts']) and now <= int(programItem['end_ts'])):
            return programItem['program_name'] + " " + programItem['program_description']
```

**Comment by audiosistem** [comment]
> Chiar in acest moment sectiunea Filme da eroare in digiapi.py:
> 
> ```
>  ERROR: EXCEPTION Thrown (PythonToCppException) : -->Python callback/script returned the following error<--
>                                              - NOTE: IGNORING THIS CAN LEAD TO MEMORY LEAKS!
>                                             Error Type: <type 'exceptions.TypeError'>
>                                             Error Contents: int() argument must be a string or a number, not 'NoneType'
>                                             Traceback (most recent call last):
>                                               File "/home/xxx/.kodi/addons/plugin.video.digionline/default.py", line 367, in <module>
>                                                 listCh(url = url, idCat=idCat)
>                                               File "/home/xxx/.kodi/addons/plugin.video.digionline/default.py", line 75, in listCh
>                                                 activeProgram = digi.getChannelActiveEpg(ch['id'])
>                                               File "/home/xxx/.kodi/addons/plugin.video.digionline/resources/digi/digiapi.py", line 202, in getChannelActiveEpg
>                                                 if(now >= int(programItem['start_ts']) and now <= int(programItem['end_ts'])):
>                                             TypeError: int() argument must be a string or a number, not 'NoneType'
>                                             -->End of Python script error report<--
> ```
> 
> Pare ca sunt situatii in care EPG-ul returneaza "None" (NoneType) pentru programItem['start_ts'] sau programItem['end_ts']. O rezolvare ar fi verificarea lor inainte de int().
> 
> ```
>   def getChannelActiveEpg(self, idChannel):
>     now = int(time.time())
>     chEpg = self.getChannelEpg(idChannel)
>     #print(chEpg)
>     if(chEpg):
>       for programItem in chEpg:
>         if((programItem['start_ts'])!= None and (programItem['end_ts'])!= None):
>           if(now >= int(programItem['start_ts']) and now <= int(programItem['end_ts'])):
>             return programItem['program_name'] + " " + programItem['program_description']
> ```
Kodi\userdata\addon_data\plugin.video.TVOnline.ro si stergi cache_data(total)si din PVRIPTVSimpleClientIntegration(tot ce este inauntru).Apoi run kodi.

**Comment by sincotan** [comment]
> > Chiar in acest moment sectiunea Filme da eroare in digiapi.py:
> > ```
> >  ERROR: EXCEPTION Thrown (PythonToCppException) : -->Python callback/script returned the following error<--
> >                                              - NOTE: IGNORING THIS CAN LEAD TO MEMORY LEAKS!
> >                                             Error Type: <type 'exceptions.TypeError'>
> >                                             Error Contents: int() argument must be a string or a number, not 'NoneType'
> >                                             Traceback (most recent call last):
> >                                               File "/home/xxx/.kodi/addons/plugin.video.digionline/default.py", line 367, in <module>
> >                                                 listCh(url = url, idCat=idCat)
> >                                               File "/home/xxx/.kodi/addons/plugin.video.digionline/default.py", line 75, in listCh
> >                                                 activeProgram = digi.getChannelActiveEpg(ch['id'])
> >                                               File "/home/xxx/.kodi/addons/plugin.video.digionline/resources/digi/digiapi.py", line 202, in getChannelActiveEpg
> >                                                 if(now >= int(programItem['start_ts']) and now <= int(programItem['end_ts'])):
> >                                             TypeError: int() argument must be a string or a number, not 'NoneType'
> >                                             -->End of Python script error report<--
> > ```
> > 
> > 
> >     
> >       
> >     
> > 
> >       
> >     
> > 
> >     
> >   
> > Pare ca sunt situatii in care EPG-ul returneaza "None" (NoneType) pentru programItem['start_ts'] sau programItem['end_ts']. O rezolvare ar fi verificarea lor inainte de int().
> > ```
> >   def getChannelActiveEpg(self, idChannel):
> >     now = int(time.time())
> >     chEpg = self.getChannelEpg(idChannel)
> >     #print(chEpg)
> >     if(chEpg):
> >       for programItem in chEpg:
> >         if((programItem['start_ts'])!= None and (programItem['end_ts'])!= None):
> >           if(now >= int(programItem['start_ts']) and now <= int(programItem['end_ts'])):
> >             return programItem['program_name'] + " " + programItem['program_description']
> > ```
> 
> Kodi\userdata\addon_data\plugin.video.TVOnline.ro si stergi cache_data(total)si din PVRIPTVSimpleClientIntegration(tot ce este inauntru).Apoi run kodi.

Nu folosesc TVOnline sau PVRIPTV.
Eroarea aparea si pe KODI 18.9 (Linux) dar si pe Libreelec 9.2.6 (KODI 18.9)

**Comment by audiosistem** [comment]
> > > Chiar in acest moment sectiunea Filme da eroare in digiapi.py:
> > > ```
> > >  ERROR: EXCEPTION Thrown (PythonToCppException) : -->Python callback/script returned the following error<--
> > >                                              - NOTE: IGNORING THIS CAN LEAD TO MEMORY LEAKS!
> > >                                             Error Type: <type 'exceptions.TypeError'>
> > >                                             Error Contents: int() argument must be a string or a number, not 'NoneType'
> > >                                             Traceback (most recent call last):
> > >                                               File "/home/xxx/.kodi/addons/plugin.video.digionline/default.py", line 367, in <module>
> > >                                                 listCh(url = url, idCat=idCat)
> > >                                               File "/home/xxx/.kodi/addons/plugin.video.digionline/default.py", line 75, in listCh
> > >                                                 activeProgram = digi.getChannelActiveEpg(ch['id'])
> > >                                               File "/home/xxx/.kodi/addons/plugin.video.digionline/resources/digi/digiapi.py", line 202, in getChannelActiveEpg
> > >                                                 if(now >= int(programItem['start_ts']) and now <= int(programItem['end_ts'])):
> > >                                             TypeError: int() argument must be a string or a number, not 'NoneType'
> > >                                             -->End of Python script error report<--
> > > ```
> > > 
> > > 
> > >     
> > >       
> > >     
> > > 
> > >       
> > >     
> > > 
> > >     
> > >   
> > > Pare ca sunt situatii in care EPG-ul returneaza "None" (NoneType) pentru programItem['start_ts'] sau programItem['end_ts']. O rezolvare ar fi verificarea lor inainte de int().
> > > ```
> > >   def getChannelActiveEpg(self, idChannel):
> > >     now = int(time.time())
> > >     chEpg = self.getChannelEpg(idChannel)
> > >     #print(chEpg)
> > >     if(chEpg):
> > >       for programItem in chEpg:
> > >         if((programItem['start_ts'])!= None and (programItem['end_ts'])!= None):
> > >           if(now >= int(programItem['start_ts']) and now <= int(programItem['end_ts'])):
> > >             return programItem['program_name'] + " " + programItem['program_description']
> > > ```
> > 
> > 
> > Kodi\userdata\addon_data\plugin.video.TVOnline.ro si stergi cache_data(total)si din PVRIPTVSimpleClientIntegration(tot ce este inauntru).Apoi run kodi.
> 
> Nu folosesc TVOnline sau PVRIPTV. Eroarea aparea si pe KODI 18.9 (Linux) dar si pe Libreelec 9.2.6 (KODI 18.9)

Bun...ai dreptate,asa e in kodi 19.Ptr.kodi(old)18,DigiOnline.ro.
